Municipality,Sector,Outage Reported,Estimated Time of Restoration,Estimated Customers Impacted,Category,Current Status
CAROLINA,"COMU. EL RESBALON Y SAN NICOLAS, COND. BALCONES DE CAROLINA, COND. CHALETS DE LA FUENTE, COND. ESTANCIAS DE METROPOLIS, COND. LOMA ALTA VILLAGE, COND. METRO MONTE, COND. MIRAFLORES, COND. PASEO DEL REY, COND. THOMAS VILLE PARK, EDIF. POWER INTERPRISES, IN",August 31 15:47',August 31 21:00',1001-1500,Unknown,"LUMA has successfully completed repairs and restored power to the area. If you have any questions, please contact us at 1-844-888-5862 (LUMA). "
SAN SEBASTIAN,"SECT. CORCOVADA, BDA. CHINTO RONDON, BDA. PUEBLO NUEVO, BDA. STALINGRADO, BDA. TABLASTILLA, COMU. GONZALEZ, SECT. CASCO URBANO, SECT. EL CALLEJON, SECT. EL TUNEL, SECT. GELO RAMOS, SECT. JUSTO PEREZ, SECT. MONTALVO, SECT. PARALELO 38, SECT. SISO QUILES, U",August 31 08:04',August 31 20:00',501-1000,Unplanned,Our power restoration team is onsite conducting critical repairs to restore power the area as quickly and safely as possible. 
AGUADILLA,"CMPD. ESTADIO LUIS A. CANENA MARQUEZ, COM. LAS CASCADAS WATER PARK, SECT. CAIMITAL ABAJO, URB. VILLA ALEGRIA, BDA. RUBIANES, COMU. CABAN, SECT. CHICO GONZALEZ, URB. ESTEVES, URB. REPARTO LOPEZ, URB. VALLE DEL ROCIO, URB. VILLA LINDA, COME. AGUADILLA TOWN ",August 31 07:59',August 31 19:00',>5000,Scheduled Maintenance,Our power restoration team is onsite conducting critical repairs to restore power the area as quickly and safely as possible. 
PEÑUELAS,"CMPD. PARQUE PASIVO PEDRO ALBIZUS CAMPO, EDU. ESCUELA ADOLFO GRANA RIVERA, PARC. TALLABOA SALIENTE, SECT. CEBORUCO, SECT. COLINAS DEL CEDRO, SECT. JUNCOS, SECT. LOS CABROS, SECT. SABANA PALMA, SECT. YAUCO",August 31 04:01',August 31 19:00',<500,Unplanned,Our power restoration team is onsite conducting critical repairs to restore power the area as quickly and safely as possible. 
Unknown,TRAMO DE GUAJATACA @ QUEBRADILLAS,August 28 13:53',August 31 21:00',<500,Unplanned,Our power restoration team is onsite conducting critical repairs to restore power the area as quickly and safely as possible.