Municipality,Sector,Outage Reported,Estimated Time of Restoration,Estimated Customers Impacted,Category,Current Status
CAGUAS,"SECT. EL CINCO, SECT. LA LOMA, SECT. LOS CLAUDIO, SECT. LOS MULEROS, SECT. TOMAS DE CASTRO 2, EDU. ESCUELA EL PARQUE, PARC. HATO, SECT. LA SAMARITANA, SECT. LOS BUXO, SECT. LOS MONTAnEZ, SECT. LOS SANCHEZ, SECT. ZAVALA, URB. EL PARQUE, URB. HACIENDAS DE S",January 18 13:42',January 18 19:00',501-1000,Unplanned,"LUMA has successfully completed repairs and restored power to the area. If you have any questions, please contact us at 1-844-888-5862 (LUMA). "
GURABO,"CMPA. LOMAS DEL SOL, COND. BUENA VISTA APARTMENTS, COND. CAMINITO, COND. VILLAS DEL SOPORTAL, EDU. COLEGIO BAUTISTA, PARC. TOQUI, PARC. VIEJAS CELADA, SECT. BELLA VISTA, SECT. CABEZUDO, SECT. CANDIDO GOMEZ, SECT. CARMELO CUADRADO, SECT. CAYANO, SECT. COLI",January 18 14:25',January 18 21:00',501-1000,Unplanned,Our power restoration team is onsite conducting critical repairs to restore power the area as quickly and safely as possible. 
VILLALBA,"BDA. COOPERATIVA, BDA. NUEVA, COMU. HACIENDA EL MAYORAL, COMU. JARDINES DE VILLA BLANCA, COND. ESTANCIAS DEL MAYORAL, SECT. CASCO URBANO, SECT. EL CERCAO, SECT. EL CHICHON, SECT. EL COLLADO, SECT. EL HOYO, SECT. EL MAGUEY, SECT. EL PUENTE, SECT. EL SEMIL,",January 18 12:30',January 19 12:00',501-1000,Unplanned,Our power restoration team is onsite conducting critical repairs to restore power the area as quickly and safely as possible.
YAUCO,"SECT. AJI, SECT. BARRIO ALGARROBO, SECT. CAMINO VIEJO, SECT. FACIO, SECT. LA JURADA, SECT. LA MONTAnA, SECT. LA URSULA, SECT. SANTA CLARA, SECT. VEGA",January 18 11:30',January 18 21:00',<500,Unplanned,Our local power restoration team is being dispatched to the area as soon as possible. 
,38KV CANOVANAS TC - {BARRA} [BARRA 2],January 18 02:49',January 18 19:00',<500,Unplanned,Our local power restoration team is being dispatched to the area as soon as possible. 
,TRAMO DE BAYAMON PUEBLO SECT. @ GUARAGUAO SECT ,December 18 16:15',January 19 23:00',<500,Unplanned,Our power restoration team is onsite conducting critical repairs to restore power the area as quickly and safely as possible.