Municipality,Sector,Outage Reported,Estimated Time of Restoration,Estimated Customers Impacted,Category,Current Status
AIBONITO,"BDA. SAN LUIS, CEM. AIBONITO MEMORIAL PARK, COMU. EXTENSION SAN LUIS, EDU. ESCUELA PASTO, PARC. VIEJAS, SECT. ALGARROBO, SECT. CAMPITO, SECT. CHRISTIAN BELEN, SECT. EL CERRO, SECT. EL NUEVE, SECT. ESPARRA, SECT. GALLARDO, SECT. LA PLAYITA, SECT. LOMAS DE ",January 20 15:57',January 20 22:00',3501-4000,Unplanned,"LUMA has successfully completed repairs and restored power to the area. If you have any questions, please contact us at 1-844-888-5862 (LUMA). "
Unknown,TRAMO DE BTC @ CANA,January 20 12:48',January 20 23:00',<500,Unplanned,"LUMA has successfully completed repairs and restored power to the area. If you have any questions, please contact us at 1-844-888-5862 (LUMA). "
SAN JUAN,"COND. LOS JARDINES DE MONTEHIEDRA, SECT. CAMINO CRUZ ROMERO, SECT. CAMINO LAS PIEDRAS FINAL, SECT. CAMINO LOS BENITEZ 1, SECT. CAMINO LOS BIGIOS, SECT. CAMINO LOS FIGUEROA, SECT. CAMINO LOS ROMEROS, SECT. CAMINO LUCIANO VAZQUEZ, SECT. FELIX VAZQUEZ, SECT.",January 20 16:16',January 20 22:00',501-1000,Unplanned,Our power restoration team is onsite conducting critical repairs to restore power the area as quickly and safely as possible. 
TRUJILLO ALTO,"SECT. FELITO TORRES, SECT. FRUTO ALEMAN, SECT. GATEWAY HILLS, SECT. JUAN ORTIZ, SECT. LOS PANELL, SECT. MANUEL ANDINO, SECT. REPARTO KENNEDY HILLS, SECT. TALANCO, SECT. WINGO ADORNO, URB. VILLA SOnADA",January 20 12:40',January 20 19:00',<500,Unplanned,Our power restoration team is onsite conducting critical repairs to restore power the area as quickly and safely as possible.
PONCE,"COND. AURORA APARTMENTS, SECT. CASCO URBANO, URB. SANTA MARIA, COME. SANTA MARIA SHOPPING CENTER, SECT. CASCO URBANO, URB. EXTENSION MARIANI, URB. MARIANI, URB. PALO DE PAN, URB. SANTA MARIA, COME. SANTA MARIA SHOPPING CENTER, COND. FERROCARRIL, URB. EXTE",January 20 09:32',January 20 19:00',1501-2000,Scheduled Maintenance,Our power restoration team is onsite conducting critical repairs to restore power the area as quickly and safely as possible. 
Unknown,TRAMO DE CANOVANAS TC @ CANOVANAS SECT,January 18 18:48',January 20 23:00',<500,Unplanned,Our power restoration team is onsite conducting critical repairs to restore power the area as quickly and safely as possible.