Municipality,Sector,Outage Reported,Estimated Time of Restoration,Estimated Customers Impacted,Category,Current Status
,,August 11 19:30',August 11 19:30',<500,Unplanned,"LUMA has successfully completed repairs and restored power to the area. If you have any questions, please contact us at 1-844-888-5862 (LUMA). "
CIALES,"COMU. ORTEGA, EDU. ESCUELA CRISTOBAL VICENS, PARC. ALTURAS DE CORDILLERA, PARC. SEGUI, SECT. LAS CRUCES, SECT. VILLALOBOS",August 11 09:24',August 11 20:00',501-1000,Unplanned,"LUMA has successfully completed repairs and restored power to the area. If you have any questions, please contact us at 1-844-888-5862 (LUMA). "
BAYAMON,"COM. COMERCIO, COND. BAYAMON GARDENS APARTMENTS, COND. CHALETS DE ROYAL PALM, COND. LA FLORESTA, HOSP. REGIONAL RUIZ ARNAU, RES. RESIDENCIAL LOS LAURELES, URB. AGUSTIN STAHL, URB. ALTURAS DE BAYAMON, URB. ALTURAS DE FLAMBOYAN, URB. INDUSTRIAL MINILLAS, UR",August 11 08:20',August 11 18:00',1501-2000,Scheduled Maintenance,"LUMA has successfully completed repairs and restored power to the area. If you have any questions, please contact us at 1-844-888-5862 (LUMA). "
SAN JUAN,"ARE. PARQUE SAN IGNACIO, URB. COLLEGE PARK, URB. EXTENSION COLLEGE PARK, URB. SAN FRANCISCO",August 11 17:58',August 11 22:30',501-1000,Unplanned,Our power restoration team is onsite conducting critical repairs to restore power the area as quickly and safely as possible. 
BAYAMON,"SECT. TORTUGUERO, URB. BRAULIO DUEnO COLON, URB. EXTENSION FOREST HILLS, URB. FLAMBOYAN GARDENS, URB. ROYAL PALM, URB. VILLA CONTESSA",August 11 11:00',August 11 21:00',<500,Unplanned,Our power restoration team is onsite conducting critical repairs to restore power the area as quickly and safely as possible. 
,"9401-01 COME. LILLY MINI MALL, PARC. GALATEO, RES. RESIDENCIAL PInAS, SECT. CIELITO, SECT. GALATEO CENTRO, SECT. GUTIERREZ, SECT. JACOBO, SECT. JALDA ARRIBA, SECT. LOS HOYOS, SECT. LOS MAMEYES, SECT. LOUBRIEL, SECT. RABO DEL BUEY, SECT. VILLA JOSCO, URB. GRAN VISTA, URB. GREEN VALLEY, URB. HACIENDA LYDIA MARIE, URB. PIEDRAS LINDAS, URB. REPARTO LAS COLINAS, URB. REPARTO SHEILI, URB. TOWN HILLS, URB. VEREDAS DEL RIO, URB. VEREDAS DEL RIO 2 9401-03 FGE. TRIBUNAL DE PRIMERA INSTANCIA SALA DE TOA ALTA, RES. RESIDENCIAL RAMON PEREZ RODRIGUEZ, SECT. CASCO URBANO, URB. ALTURAS DEL TOA, URB. JARDINES DEL TOA, URB. REPARTO DIAZ, URB. VILLA MARIA 9202-01 COM. FERRETERIA NATIONAL, COMU. SAN ANTONIO, RES. RESIDENCIAL MANUEL MORALES, SECT. CASCO URBANO, URB. BRISAS DEL PLATA, URB. JARDINES DE DORADO, URB. MARTORELL 9202-03 ARE. CENTRO COMUNAL DORADO DEL MAR, CMPR. DORADO DEL MAR, COME. DORADO DEL MAR SHOPPING CENTER, COM. GASOLINERA PUMA, COND. BRISAS DEL MAR, COND. CAMINO DORADO, COND. VILLA DE PLAYA 1, COND. VILLA DE PLAYA 2, SECT. CASCO URBANO, URB. DORADO DEL MAR, URB. SARDINERA BEACH 9202-04 BO. HIGUILLAR, BO. SAN ANTONIO",August 10 16:50',August 11 23:00',1001-1500,3rd Party Damage,Our local power restoration team is being dispatched to the area as soon as possible. 