Municipality,Sector,Outage Reported,Estimated Time of Restoration,Estimated Customers Impacted,Category,Current Status
SAN GERMAN,"COND. PORTA COELI, HOSP. HOSPITAL DE LA CONCEPCION, IND. ZONA INDUSTRIAL BARRIO CAIN ALTO, PARC. LAS CAROLINAS, RES. RESIDENCIAL EL RECREO, RES. RESIDENCIAL MANUEL F. ROSSY, SECT. LA CUCHILLA, URB. ARQUELIO TORRES, URB. EL CONVENTO, URB. EL PEDREGAL, URB.",February 10 18:44',February 11 17:00',501-1000,Unplanned,"LUMA has successfully completed repairs and restored power to the area. If you have any questions, please contact us at 1-844-888-5862 (LUMA). "
,DORADO TC - ACB 1309A,January 30 00:10',February 14 23:00',<500,Unplanned,Our power restoration team is onsite conducting critical repairs to restore power the area as quickly and safely as possible.
Unknown,TRAMO DE CANOVANAS TC @ CANOVANAS SECT,January 18 18:48',February 14 23:00',<500,Unplanned,Our power restoration team is onsite conducting critical repairs to restore power the area as quickly and safely as possible.
SAN JUAN,"COND. LOS JARDINES DE MONTEHIEDRA, SECT. CAMINO CRUZ ROMERO, SECT. CAMINO LAS PIEDRAS FINAL, SECT. CAMINO LOS BENITEZ 1, SECT. CAMINO LOS BIGIOS, SECT. CAMINO LOS FIGUEROA, SECT. CAMINO LOS ROMEROS, SECT. CAMINO LUCIANO VAZQUEZ, SECT. FELIX VAZQUEZ, SECT.",February 11 16:34',February 11 21:00',501-1000,Unplanned,Our power restoration team is onsite conducting critical repairs to restore power the area as quickly and safely as possible.
MANATI,"BDA. FELIX CORDOVA DAVILA, COMU. ALTAGRACIA, COND. MANATI PLAZA APARTMENTS, EDU. ESCUELA FELIX CORDOVA DAVILA, IND. INDUSTRIAL SAN JOSE, RES. RESIDENCIAL ENRIQUE ZORRILLA, SECT. CASCO URBANO, SECT. CORDOVA DAVILA, SECT. CUESTA MARIN, SECT. REPARTO MEJIAS,",February 11 07:30',February 11 21:00',<500,Scheduled Maintenance,Our power restoration team is onsite conducting critical repairs to restore power the area as quickly and safely as possible. 
PONCE,"BDA. BORINQUEN, COND. VILLA PONCE HOUSING FOR THE ELDERLY, RES. RESIDENCIAL LOS ROSALES, RES. RESIDENCIAL PERLA DEL CARIBE, RES. RESIDENCIAL PONCE HOUSING, RES. RESIDENCIAL TIBES TOWN HOUSE, RES. RESIDENCIAL TORMOS DIEGO, RES. RESIDENCIAL VILLA ELENA, SEC",February 11 07:25',February 11 21:00',>5000,Scheduled Maintenance,Our power restoration team is onsite conducting critical repairs to restore power the area as quickly and safely as possible. 
PONCE,"COND. VILLA PANNONIA, EDIF. MARVESA, RES. RESIDENCIAL DOCTOR JOSE N. GANDARA, URB. ALHAMBRA COURT GARDENS, URB. ANAIDA COURTS, URB. BELLA VISTA, URB. JARDINES FAGOT, URB. LA ALHAMBRA, URB. SANTA CLARA, URB. VILLA ESPERANZA, RES. EXTENSION RESIDENCIAL DOCT",February 11 07:13',February 11 21:00',2501-3000,Scheduled Maintenance,Our power restoration team is onsite conducting critical repairs to restore power the area as quickly and safely as possible. 
OROCOVIS,TRAMO DE ACB 6509 @ MOD 6523,February 03 09:28',February 14 23:00',<500,Unplanned,Our power restoration team is onsite conducting critical repairs to restore power the area as quickly and safely as possible.
,TRAMO DE PORTUGUEZ @ CANAS TC,February 02 01:00',February 14 23:00',<500,Unplanned,Our power restoration team is onsite conducting critical repairs to restore power the area as quickly and safely as possible.