Municipality,Sector,Outage Reported,Estimated Time of Restoration,Estimated Customers Impacted,Category,Current Status
HORMIGUEROS,"COME. PLAZA LOS PEREGRINOS, COND. HORMIGUEROS APARTMENTS, COND. LA MONSERRATE COURT, COND. VERDUN , PARC. LAVADERO, PARC. SAN ROMUALDO, URB. COLINAS DEL OESTE, URB. ESTANCIAS DEL RIO, URB. HACIENDAS CONSTANCIA, URB. LA MONSERRATE, URB. MANSIONES LA MONSER",April 27 17:55',April 27 23:00',1501-2000,Unplanned,"LUMA has successfully completed repairs and restored power to the area. If you have any questions, please contact us at 1-844-888-5862 (LUMA). "
QUEBRADILLAS,"SECT. LA SABANA, SECT. MANDELLES, SECT. PALOMAR, URB. HACIENDA LA SABANA, COMU. COCOS, COND. VILLA JULIA, EDU. ESCUELA SEGUNDA UNIDAD LUIS MUnOZ RIVERA, SECT. LOS BORGES, SECT. LOS CHAVES, URB. DOS CEIBAS, URB. LA CEIBA, URB. SANTA MARINA",April 27 17:03',April 27 23:00',1001-1500,Unplanned,"LUMA has successfully completed repairs and restored power to the area. If you have any questions, please contact us at 1-844-888-5862 (LUMA). "
BAYAMON,URB. INDUSTRIAL MINILLAS,April 27 12:33',April 27 20:00',<500,Unplanned,"LUMA has successfully completed repairs and restored power to the area. If you have any questions, please contact us at 1-844-888-5862 (LUMA). "
HUMACAO,"COND. AQUABELLA, COND. BEACH VILLAGE, COND. CRESCENT BEACH, COND. CRESCENT COVE, COND. FAIRLAKES 3, COND. FAIRLAKES VILLAGE, COND. FAIRWAY COURTS, COND. FAIRWAY COURTS VILLAS, COND. HACIENDAS DE PALMAS, COND. HARBOUR LAKES, COND. LA JOLLA, COND. LAS VILLA",April 27 17:54',April 27 23:00',4001-4500,Unplanned,Our local power restoration team is being dispatched to the area as soon as possible. 
SAN JUAN,TRAMO DE L-1000 ENTRE ACB 1001C @ UPR @ GANDARA,April 11 22:44',April 29 23:00',<500,Unplanned,Our power restoration team is onsite conducting critical repairs to restore power the area as quickly and safely as possible.