Municipality,Sector,Outage Reported,Estimated Time of Restoration,Estimated Customers Impacted,Category,Current Status
DORADO,EL GUACARO,May 27 17:03',May 27 22:00',<500,Unplanned,"LUMA has successfully completed repairs and restored power to the area. If you have any questions, please contact us at 1-844-888-5862 (LUMA). "
Unknown,TRAMO > CANAS TC > COSTA SUR,May 27 14:40',May 27 23:00',<500,Unplanned,Our power restoration team is onsite conducting critical repairs to restore power the area as quickly and safely as possible.
SAN JUAN,URB. CAPARRA TERRACE,May 27 13:30',May 27 23:00',<500,Unknown,Our power restoration team is onsite conducting critical repairs to restore power the area as quickly and safely as possible. 
,CAMBALACHE TC – FACTOR ,May 24 18:38',May 29 23:00',<500,Unplanned,Our power restoration team is onsite conducting critical repairs to restore power the area as quickly and safely as possible.
CATAÑO,TRAMO DE CATAnO PDS @ BAYVIEW,May 16 15:14',May 29 23:00',<500,Unplanned,Our power restoration team is onsite conducting critical repairs to restore power the area as quickly and safely as possible.