Municipality,Sector,Outage Reported,Estimated Time of Restoration,Estimated Customers Impacted,Category,Current Status
CAGUAS,"BDA. MORALES, CMPD. COMPLEJO DEPORTIVO MUNIPAL DE CAGUAS, COME. LAS CATALINAS MALL, COM. GASOLINERA SHELL, COND. BALCONES DE LAS CATALINAS, COND. EL MIRADOR APARTMENTS, COND. PASEO DEGETAU, COND. TURABO CLUSTER, COND. VISTA REAL 1, COND. VISTA REAL 2, CON",December 01 14:13',December 01 20:00',2501-3000,Unplanned,"LUMA has successfully completed repairs and restored power to the area. If you have any questions, please contact us at 1-844-888-5862 (LUMA). "
,"DAGUAO - VIEQUES   COME. SANTA MARIA, COMU. BARRIO SACO, COND. BRISAS DE CEIBA COURT, EDU. ESCUELA PARCELAS AGUAS CLARAS, PARC. AGUAS CLARAS, PARC. LAS CALDERONAS, PARC. MACHOS, PARC. NUEVAS, RES. RESIDENCIAL JARDINES DE CEIBA, RES. RESIDENCIAL LA CEIBA, SECT. QUEBRADA SECA, URB. BRISAS DE CEIBA, URB. ESTANCIAS DE PRADO HERMOSO, URB. EXTENSION VILLA DEL PILAR, URB. JARDINES AVILA, URB. JARDINES DE CEIBA 1, URB. RAMOS ANTONINI, URB. ROSSY VALLEY, URB. SANTA MARIA, URB. VALLE DE CEIBA, URB. VEGAS DE CEIBA, URB. VILLA DEL PILAR, URB. VILLA FLORES, PARC. LUIS M CINTRON, SECT. CAMACHO, URB. ESTANCIAS DEL MAR, URB. LAS GAVIOTAS, URB. ROOSEVELT GARDENS, PARC. DAGUAO, PARC. NUEVAS DAGUAO, PARC. VIEJAS DAGUAO, URB. PROMISED LAND",November 30 14:40',December 01 23:00',<500,Unplanned,Our power restoration team is onsite conducting critical repairs to restore power the area as quickly and safely as possible.
Unknown,TRAMO DE ACB 5327B @ OCB 5340,November 27 12:40',December 01 23:00',<500,Unplanned,Our power restoration team is onsite conducting critical repairs to restore power the area as quickly and safely as possible.
SAN JUAN,"COND. PARQUE DE LAS PALOMAS, HTL. HOTEL EL CONVENTO, SECT. CATEDRAL",December 01 14:13',December 01 22:00',1001-1500,Unplanned,Our power restoration team is onsite conducting critical repairs to restore power the area as quickly and safely as possible. 
SAN JUAN,"COM. IL CUOCO, COM. INSTANT PRINT, COM. KIMPO GARDEN, COND. EL MONTE NORTE, COND. EL MONTE SUR, COND. EL MONTE SUR TOWN HOUSES, URB. BALDRICH, URB. HYDE PARK",December 01 12:13',December 01 22:00',<500,Unplanned,Our power restoration team is onsite conducting critical repairs to restore power the area as quickly and safely as possible. 