Municipality,Sector,Outage Reported,Estimated Time of Restoration,Estimated Customers Impacted,Category,Current Status
,"DAGUAO - VIEQUES   COME. SANTA MARIA, COMU. BARRIO SACO, COND. BRISAS DE CEIBA COURT, EDU. ESCUELA PARCELAS AGUAS CLARAS, PARC. AGUAS CLARAS, PARC. LAS CALDERONAS, PARC. MACHOS, PARC. NUEVAS, RES. RESIDENCIAL JARDINES DE CEIBA, RES. RESIDENCIAL LA CEIBA, SECT. QUEBRADA SECA, URB. BRISAS DE CEIBA, URB. ESTANCIAS DE PRADO HERMOSO, URB. EXTENSION VILLA DEL PILAR, URB. JARDINES AVILA, URB. JARDINES DE CEIBA 1, URB. RAMOS ANTONINI, URB. ROSSY VALLEY, URB. SANTA MARIA, URB. VALLE DE CEIBA, URB. VEGAS DE CEIBA, URB. VILLA DEL PILAR, URB. VILLA FLORES, PARC. LUIS M CINTRON, SECT. CAMACHO, URB. ESTANCIAS DEL MAR, URB. LAS GAVIOTAS, URB. ROOSEVELT GARDENS, PARC. DAGUAO, PARC. NUEVAS DAGUAO, PARC. VIEJAS DAGUAO, URB. PROMISED LAND",November 30 14:40',December 02 23:00',<500,Unplanned,Our power restoration team is onsite conducting critical repairs to restore power the area as quickly and safely as possible.
Unknown,TRAMO DE ACB 5327B @ OCB 5340,November 27 12:40',December 02 23:00',<500,Unplanned,Our power restoration team is onsite conducting critical repairs to restore power the area as quickly and safely as possible.
,Acacias TC - Boqueron T.O ,December 02 16:52',December 02 23:00',<500,Unplanned,Our local power restoration team is being dispatched to the area as soon as possible. 
GURABO,"BDA. CAMPAMENTO, CMPG. GUARDIA NACIONAL, IND. ZONA INDUSTRIAL O'REILLY, RES. RESIDENCIAL LUIS DEL CARMEN ECHEVARRIA, URB. EXTENSION VILLA MARINA, URB. VILLA MARINA, EDU. ESCUELA MARGARITA RIVERA DE JANER, PARC. TOQUI, RES. RESIDENCIAL LUIS DEL CARMEN ECHE",December 02 06:44',December 02 19:00',>5000,Scheduled Maintenance,Our power restoration team is onsite conducting critical repairs to restore power the area as quickly and safely as possible. 
SAN JUAN,"CMPE. COLEGIO UNIVERSITARIO DE SAN JUAN, CMPG. FEDERAL COURT BUILDINGS, COND. PARQUE CENTRO, COND. SAN JUAN CHATEAU, IND. URBANIZACION INDUSTRIAL TRES MONJITAS",December 02 02:15',December 02 19:00',<500,Unplanned,Our power restoration team is onsite conducting critical repairs to restore power the area as quickly and safely as possible. 
SAN JUAN,"COND. PARQUE DE LAS PALOMAS, HTL. HOTEL EL CONVENTO, SECT. CATEDRAL",December 01 14:13',December 02 19:00',<500,Unplanned,Our power restoration team is onsite conducting critical repairs to restore power the area as quickly and safely as possible. 