Municipality,Sector,Outage Reported,Estimated Time of Restoration,Estimated Customers Impacted,Category,Current Status
PONCE,"COMU. BRISAS DEL LAGO, COMU. CERRILLO HOYOS, COMU. COTO LAUREL, EDU. ESCUELA INTERMEDIA JUAN SERRALLES, EDU. ESCUELA SUPERIOR JUAN SERRALES, SECT. CERRILLO HOYOS, SECT. PALMAREJO, URB. HACIENDAS ANA MARIA, URB. LLANOS DEL SUR",March 17 18:29',March 17 23:00',501-1000,Unplanned,"LUMA has successfully completed repairs and restored power to the area. If you have any questions, please contact us at 1-844-888-5862 (LUMA). "
BAYAMON,"CMPS. CENTRO DE REHABILITACION, COM. BANCO POPULAR DE PUERTO RICO, COM. BURGER KING, COM. CARIBBEAN CINEMAS, COM. CHILLI'S, COME. PLAZA RIO HONDO, COND. CHALETS DE RIO HONDO 3, RES. RESIDENCIAL BRISAS DE BAYAMON, SECT. LA CAMBIJA, URB. CAMPO VERDE, URB. E",March 17 16:05',March 17 20:00',501-1000,Unplanned,"LUMA has successfully completed repairs and restored power to the area. If you have any questions, please contact us at 1-844-888-5862 (LUMA). "
TOA BAJA,"CMPG. PARQUE DE LAS CIENCIAS, COME. CANTON MALL, COME. PLAZA DEL SOL, COME. PLAZOLETA DEL CANTON, COND. SIERRA BAYAMON APARTMENTS, COND. SIERRA BAYAMON APARTMENTS 750, EDU. ESCUELA INTERMEDIA CACIQUE AGUEYBANA, RES. RESIDENCIAL SIERRA BAYAMON APARTMENTS, ",March 17 15:55',March 17 21:00',501-1000,Unplanned,"LUMA has successfully completed repairs and restored power to the area. If you have any questions, please contact us at 1-844-888-5862 (LUMA). "
JAYUYA,"CARR 144 INT 140, BO COLLORES; JAYUYA",March 17 10:23',March 17 20:00',1501-2000,Scheduled Maintenance,"LUMA has successfully completed repairs and restored power to the area. If you have any questions, please contact us at 1-844-888-5862 (LUMA). "
,COSTA SUR S.P. - MAYAGUEZ T.C.,March 15 00:46',March 17 23:00',<500,Unplanned,"LUMA has successfully completed repairs and restored power to the area. If you have any questions, please contact us at 1-844-888-5862 (LUMA). "
CABO ROJO,"COM. FARMACIA WALGREENS, COMU. ELIZABETH, COMU. ELIZABETH 3, COMU. EXTENSION ELIZABETH, COMU. PUERTO REAL, COND. CAYO DEL SOL, COND. MARIE GARDEN APARTMENTS, COND. PLAYA BUYE, COND. PUERTAS DE BUYE, EDU. ESCUELA ELEMENTAL JAMES GARFIELD, IND. COMBATE GUES",March 17 17:15',March 17 21:00',2501-3000,Unplanned,Our local power restoration team is being dispatched to the area as soon as possible. 
AGUAS BUENAS,"SECT. CAMINO NUEVO, SECT. EL PERICO, SECT. LA BRUSCA, SECT. LOS FONTANEZ, COMU. MILLO CABRERA, COND. VISTAS DE JAGUEYES 1, COND. VISTAS DE JAGUEYES 2, RES. RESIDENCIAL ESPIRITU SANTO, RES. RESIDENCIAL VILLA MONSERRATE, SECT. BRUNO ROSA, SECT. CAMPO ALTO 1",March 17 06:27',March 17 22:00',>5000,Scheduled Maintenance,Our power restoration team is onsite conducting critical repairs to restore power the area as quickly and safely as possible. 