Municipality,Sector,Outage Reported,Estimated Time of Restoration,Estimated Customers Impacted,Category,Current Status
LARES,"COME. LARES MEDICAL CENTER, COND. LARES GARDENS, EDU. ESCUELA DOMINGO APONTE COLLAZO, EDU. ESCUELA IGNACIO DICUPE GONZALEZ, SECT. LA SIERRA, URB. BUENA VISTA, URB. VILLA SERAL",August 06 16:50',August 06 23:00',501-1000,Unplanned,Our power restoration team is onsite conducting critical repairs to restore power the area as quickly and safely as possible. 
CAGUAS,"CEM. CEMENTERIO BORINQUEN MEMORIAL PARK 1, SECT. EL EDEN, URB. ALTOMONTE, URB. ARBOLADA, URB. BAIROA PARK, URB. BAIROA PARK 2, URB. EL RETIRO, URB. ESTANCIAS DEL TURABO, URB. ESTANCIAS DE SANTA TERESITA, URB. MIRADOR DE BAIROA, URB. PARQUE CENTRAL",August 06 16:18',August 06 23:00',501-1000,Unplanned,Our local power restoration team is being dispatched to the area as soon as possible. 
MAYAGUEZ,"PARC. NUEVAS MARINI, PARC. SAN CARLOS, SECT. BALBOA, SECT. CALLE FRONTONES, SECT. CAMINO JUSTINIANO, SECT. CAMINO LOS LECLERC, SECT. CAMINO LOS SANCHEZ, SECT. CAMINO PABLO FLORES OLIVIERI, SECT. CAMINO PARES, SECT. CAMINO SANTALIZ, SECT. CASCO URBANO, SEC",August 06 14:12',August 06 20:00',3501-4000,Unplanned,Our power restoration team is onsite conducting critical repairs to restore power the area as quickly and safely as possible. 
BAYAMON,"CMPS. CENTRO DE REHABILITACION, COM. BANCO POPULAR DE PUERTO RICO, COM. BURGER KING, COM. CARIBBEAN CINEMAS, COM. CHILLI'S, COME. PLAZA RIO HONDO, COND. CHALETS DE RIO HONDO 3, RES. RESIDENCIAL BRISAS DE BAYAMON, SECT. LA CAMBIJA, URB. CAMPO VERDE, URB. E",August 06 12:20',August 06 19:00',501-1000,Unplanned,Our local power restoration team is being dispatched to the area as soon as possible. 
CAGUAS,"COME. CONSOLIDATED MALL, COND. BRISAS DE SAN ALFONSO, COND. LOS FLAMBOYANES 3, COND. PASEO EL VERDE, RES. RESIDENCIAL BRISAS DEL TURABO, SECT. LA INDUSTRIA, SECT. SANTO DOMINGO, URB. EL VERDE, URB. EL VERDE SUR, URB. ESTANCIAS EL VERDE, URB. EXTENSION EL ",August 06 12:06',August 06 19:00',<500,Unplanned,Our power restoration team is onsite conducting critical repairs to restore power the area as quickly and safely as possible. 
CANOVANAS,"CIUDAD JARDIN DE CANOVANAS, QUINTAS DE CANOVANAS, CANOVANAS MALL",August 06 08:45',August 06 19:00',501-1000,Scheduled Maintenance,Our power restoration team is onsite conducting critical repairs to restore power the area as quickly and safely as possible. 
SAN JUAN,"URB. PUERTO NUEVO, CALLES: 18 NW Y 4,7,11,16 NE, URB. BORINQUEN CALLES CADIS, CALLE: DRESDEN, CAIRO, DALMACIA, DECATOUR. COMERCIALES: PANADERIA LA CEIBA, ABUELO AUTO PARTS, ARKITEKTURA, BANCO POPULAR, RESTAURANT CASA ANTONIO, ECONO TOOLS, CORREA TIRE, EL ",August 06 08:05',August 06 19:00',501-1000,Scheduled Maintenance,Our power restoration team is onsite conducting critical repairs to restore power the area as quickly and safely as possible. 
,TRAMO DE CAMBALACHE - MIRADOR AAA (ISLOTE) SUB 8086,August 06 02:24',August 06 19:00',<500,Unplanned,Our power restoration team is onsite conducting critical repairs to restore power the area as quickly and safely as possible. 