Municipality,Sector,Outage Reported,Estimated Time of Restoration,Estimated Customers Impacted,Category,Current Status
COAMO,"BDA. SAN LUIS, BDA. ZAMBRANA, CEM. CEMENTERIO MUNICIPAL DE COAMO, COND. VISTAS DE SAMBRANA, EDU. ESCUELA ELEMENTAL JOSE RAMON RODRIGUEZ, EDU. ESCUELA PURIFICACION RODRIGUEZ, PARC. NIAGARA, SECT. CASCO URBANO, URB. VILLA MADRID, URB. VILLAS DE SAN BLAS, UR",December 09 09:30',December 09 22:00',<500,Scheduled Maintenance,"LUMA has successfully completed repairs and restored power to the area. If you have any questions, please contact us at 1-844-888-5862 (LUMA). "
YABUCOA,"COME. PLAZA YABUCOA SHOPPING CENTER, COM. GARAJE SHELL, COMU. EL NEGRO CAMINO NUEVO, EDU. ESCUELA FRANCISCO SUSTACHE, IND. PUERTO RICO SUN OIL COMPANY, IND. ZONA INDUSTRIAL BARRIO JUAN MARTIN, PARC. EL NEGRO, SECT. EL GUANO, SECT. EL NEGRO, SECT. POBLADO ",December 09 09:20',December 09 19:00',1001-1500,Scheduled Maintenance,"LUMA has successfully completed repairs and restored power to the area. If you have any questions, please contact us at 1-844-888-5862 (LUMA). "
YABUCOA,"JACANAS, LIMONES, CAMINO NUEVO, JARDINES DE YABUCOA, VALLE DE YABUCOA, CENTRO COMERCIAL RALPHS, BPPR, WALGREENS, UNIVERSIDAD DEL TURABO",December 09 08:01',December 09 19:00',3001-3500,Scheduled Maintenance,"LUMA has successfully completed repairs and restored power to the area. If you have any questions, please contact us at 1-844-888-5862 (LUMA). "
,Yauco 2 - San German TC ,December 09 17:05',December 10 23:00',<500,Unplanned,Our power restoration team is onsite conducting critical repairs to restore power the area as quickly and safely as possible.
SAN GERMAN,"COND. PORTA COELI, HOSP. HOSPITAL DE LA CONCEPCION, IND. ZONA INDUSTRIAL BARRIO CAIN ALTO, PARC. LAS CAROLINAS, RES. RESIDENCIAL EL RECREO, RES. RESIDENCIAL MANUEL F. ROSSY, SECT. LA CUCHILLA, URB. ARQUELIO TORRES, URB. EL CONVENTO, URB. EL PEDREGAL, URB.",December 09 13:19',December 09 22:00',1001-1500,Unplanned,Our local power restoration team is being dispatched to the area as soon as possible. 